Submission id,id,Started at,Reviewed at,Total approvals,Siblings,Age,Sex,female,Ethnicity,Countryofbirth,Country of residence,Nationality,Language,Student status,Employment status,session,IPAddress,Duration,Treatment,control,t1,t2,ResponseId,LocationLatitude,LocationLongitude,UserLanguage,Q6 Comp,Action1,blue,Advice1,timer action 1_First Click,timer action 1_Last Click,pagetimerSH,timer action 1_Click Count,Dnorm1,Snorm1,Comp2,Action2,Advice2,Timer action 2 _First Click,Timer action 2 _Last Click,pagetimerPGG,Timer action 2 _Click Count,DNorm2,SNorm2,Comp3,Action3,Advice3,Timer action 3 _First Click,Timer action 3 _Last Click,pagetimerDic,Timer action 3 _Click Count,DNorm3,SNorm3,Lotteries,risktolerance,wealth,poor,lowerincome,describe kinship ,sibling ,hassibling,Kin,closeness,Service,kin2,close2
66a1156c349d83f805ed2848,663a27434f1bdf79b8744994,2024-07-24T15:00:48.651000Z,2024-07-24T16:34:24.209000Z,261,Yes,39,Male,0,White,United States,United States,United States,English,No,Part-Time,5,75.142.137.148,609,c,1,0,0,R_25G7RYiOkLzQFYp,42.1921,-121.7233,EN,50 tokens,Blue,1,More money for both people is the way to go. There is not a whole lot of strategy to this decision. It wouldn't make sense to try and choose less money intentionally.,2.152,33.165,74.991,3,Blue,Blue,125 Tokens,50,"I'm deciding to go with the middle ground at 50. That way, either way I know I can get a bonus even if my partner does not contribute anything.",5.851,43.347,43.624,3,50,50,80 tokens,50,This one is easy. Just be fair and split the money evenly. I don't see a reason to take it all for yourself.,3.321,3.889,33.257,2,50,50,"Gamble 1: Event A, Payoff: 10 tokens; Event B, Payoff: 10 tokens",1,well off,0,0,"means being family, or being so close to someone, that you can consider them to be a family member.",Yes,1,I have a brother/brothers,9,No,,
66a1108c900150cf02b79f46,664b45586572fa7fbd45b2d3,2024-07-24T14:32:53.667000Z,2024-07-24T16:31:52.847000Z,13,Yes,25,Male,0,White,United States,United States,United States,English,No,Part-Time,2,67.173.188.2,348,c,1,0,0,R_eWn8JzrTOQDeEut,44.9427,-93.2871,EN,50 tokens,Blue,1,Pick whatever color you want.It’s up to the other persons action if they get 50 coins.If you have blue and they pick blue you both win ,2.077,49.066,83.101,4,Yellow,Yellow,100 Tokens,50,I like to give half to the public fund.Hope that you both choose th same color ,2.932,28.806,45.301,5,50,50,80 tokens,20,I give them some of what I have.Hope you both pick the same colors for a better pay.Give what you feel is right ,3.054,53.707,53.76,5,20,50,"Gamble 1: Event A, Payoff: 10 tokens; Event B, Payoff: 10 tokens",1,well off,0,0,A person who is related to you and you share the same interests and values ,Yes,1,I have a brother/brothers,0,No,,
66a10ee9108703ff458c35f4,6658b277db96699abc25defd,2024-07-24T14:25:51.605000Z,2024-07-24T16:33:09.066000Z,100,Yes,29,Male,0,White,United States,United States,United States,English,No,"Not in paid work (e.g. homemaker', 'retired or disabled)",5,98.34.136.66,485,c,1,0,0,R_r6BtcLC3I6nPPxv,29.7388,-95.8309,EN,50 tokens,Blue,1,Hopefully my partner realizes the higher payout if they choose blue,3.058,5.184,36.604,3,Blue,Blue,125 Tokens,96,Better payout if we both contribute max amount to the public fund,7.826,45.858,51.854,4,96,100,80 tokens,50,This would be best payout for both parties. It is fair. Both parties win.,3.657,9.828,52.544,4,50,50,"Gamble 1: Event A, Payoff: 10 tokens; Event B, Payoff: 10 tokens",1,well off,0,0,someone who is related to me. ,Yes,1,"I have both, brother(s) and sister(s)",7,Yes,No,5
66a1131408b228698f0ecbf5,66699d98d268f725f96b8f4c,2024-07-24T14:52:40.941000Z,2024-07-24T16:33:18.043000Z,27,Yes,27,Male,0,White,Belgium,Australia,Australia,Dutch,No,Full-Time,4,1.152.110.36,404,c,1,0,0,R_3qlB9pMG1azQGxy,-37.8182,144.9443,EN,50 tokens,Blue,1,"If everyone goes for the max payout (blue), we all win! It pays off to not be selfish.",2.166,47.991,68.735,8,Blue,Blue,125 Tokens,100,"If its guaranteed to grow by 50%, its a no brainer to invest into the public fund.",2.53,10.375,39.447,3,70,100,80 tokens,50,"If you go the 50/50 way, it keeps things fair for everyone. Again, pags off not to be selfish",7.517,56.731,59.76,5,21,50,"Gamble 1: Event A, Payoff: 10 tokens; Event B, Payoff: 10 tokens",1,well off,0,0,"To look after one another amongst your peers, friends and family",Yes,1,I have a sister/sisters,7,No,,
66a11535ce60b47e7160dc57,5dc7b9d4be3c0f566da4d00c,2024-07-24T14:52:41.998000Z,2024-07-24T16:34:22.566000Z,443,Yes,38,Male,0,White,United States,United States,United States,English,No,Part-Time,5,72.226.41.37,420,c,1,0,0,R_0HDOX75fo6S3Qnn,40.7465,-73.909,EN,50 tokens,Blue,1,"If you chose yellow you are guaranteed 50 tokens. If one of us choose blue and the other chooses yellow, no guarantee on token payout. If we both choose blue we get 100 coins ",1.878,8.875,51.641,2,Yellow,Yellow,100 Tokens,50,You will receive 50 percent growth of what you contribute. The amount you choose affects you and your Werner.,4.383,36.213,59.8,6,50,100,80 tokens,50,Your contribution affects role b. The amount you choose will be minuses from 100. Role b will get the amount you allocate ,11.974,14.492,45.454,2,50,50,"Gamble 1: Event A, Payoff: 10 tokens; Event B, Payoff: 10 tokens",1,well off,0,0,Empathizing and deeply caring about my fellows,Yes,1,"I have both, brother(s) and sister(s)",8,No,,
66a10f44f7eb94ad3875ac0e,5e285ed797a5fd000a981cd4,2024-07-24T14:27:23.286000Z,2024-07-24T16:33:16.594000Z,390,Yes,35,Male,0,White,Mexico,United States,United States,Spanish,No,Part-Time,5,47.184.143.181,368,c,1,0,0,R_2RVzGtMDI1xT9bt,32.9219,-96.6214,EN,50 tokens,Blue,1,"I think this was an easy choice.  If both parties want to maximize their tokens, then they should choose blue.",26.513,31.169,66.903,2,Blue,Blue,125 Tokens,50,"This choice was more complicated than the choice between blue and yellow.  I am guessing the best decision is to give 50 tokens to the public fund, and keep 50 for yourself.",5.305,7.719,50.436,2,50,50,80 tokens,50,"I'd like to be fair to my partner, so I would allocate half of my tokens.  ",5.776,7.054,26.866,2,50,50,"Gamble 1: Event A, Payoff: 10 tokens; Event B, Payoff: 10 tokens",1,well off,0,0,It means people from your family that share your bloodline.,Yes,1,"I have both, brother(s) and sister(s)",6,No,,
66a10f11290023885112c561,60cb9d680909d3c4756c8a10,2024-07-24T14:26:29.400000Z,2024-07-24T16:33:12.950000Z,221,Yes,28,Male,0,White,Portugal,Portugal,Portugal,Portuguese,Yes,Full-Time,1,85.138.139.132,1312,c,1,0,0,R_3G1ibfKSziTDbCM,37.1367,-8.5334,PT,50 tokens,Blue,1,"If chosing blue provides a solid and precise 100, then I belive everybody should go for blue and make surre everybody gets the 100. ",11.549,123.16,137.815,11,Blue,Blue,125 Tokens,50,Regarding the amounts provided and the rules that were described I belive that the propor amount to contribute to the fund should be 50.,4.545,9.9,81.338,4,50,50,80 tokens,50,"I belive that if we had 100 between us, I should allocate half of it to the other part, because it would be the fare thing to do .",12.296,127.973,128.803,8,20,50,"Gamble 1: Event A, Payoff: 10 tokens; Event B, Payoff: 10 tokens",1,well off,0,0,It means family.,Yes,1,I have a brother/brothers,9,No,,
66a10ef122f9b0284a3503b6,610015973be716a2cc07f6a0,2024-07-24T14:25:56.728000Z,2024-07-24T16:33:09.648000Z,144,Yes,26,Male,0,White,Portugal,Portugal,Portugal,Portuguese,Yes,Unemployed (and job seeking),4,2.80.89.164,893,c,1,0,0,R_DOGaRSlpyw6vr2N,41.4456,-8.2929,PT,50 tokens,Blue,1,Yellow strategy is the safe one because 50 tokens are always guaranteed.,40.661,82.199,133.31,4,Yellow,Blue,100 Tokens,25,"Choose the number you are more comfortable with. It's important to note that the larger the fund, the larger return on investment.",4.319,41.159,104.687,7,50,50,80 tokens,20,If you want ore tokens you need to allocate few tokens to the other player,7.073,25.068,56.711,14,20,50,"Gamble 1: Event A, Payoff: 10 tokens; Event B, Payoff: 10 tokens",1,well off,0,0,"Family relationships, sense of belonging",Yes,1,I have a brother/brothers,6,No,,
66a10f026c10b53f277ce734,5e15bb77e78021b9d45d8cf4,2024-07-24T14:26:14.212000Z,2024-07-24T16:33:11.488000Z,264,Yes,27,Male,0,White,United States,United States,United States,English,No,Full-Time,5,71.178.253.170,443,c,1,0,0,R_1CkcJrzcE9JhCdf,38.9779,-77.0806,EN,50 tokens,Blue,1,I hope that most people will be thoughtful and choose blue so everyone can get a bigger bonus ,2.755,36.835,37.295,6,Yellow,Blue,100 Tokens,49,"When participating, please be mindful of others and contribute to the greater good.",3.121,51.107,59.608,9,34,50,80 tokens,40,Be thoughtful about how player b feels. Be kind and share what you have for the future player please,4.044,35.863,36.34,4,18,50,"Gamble 1: Event A, Payoff: 10 tokens; Event B, Payoff: 10 tokens",1,well off,0,0,Kinship means someone who cares about you,Yes,1,I have a brother/brothers,8,No,,
66a1170fbc1921794a60dcdf,60f801efc0846c47e4e755e6,2024-07-24T15:00:30.999000Z,2024-07-24T16:33:18.308000Z,715,Yes,23,Male,0,Other,Mexico,Mexico,Mexico,Spanish,Yes,Part-Time,4,177.228.166.253,485,c,1,0,0,R_6gLPPj0xrDWUGLT,25.527,-103.3547,ES-ES,50 tokens,Blue,1,Just choose whatever you want. It´s kind of a lucky or guessing game.,1.977,54.619,58.583,9,Blue,Yellow,125 Tokens,50,"Choose a number that is not too high or too low, so you can get a good reward",5.267,10.586,39.185,4,50,50,80 tokens,0,"I think that depends on you, but I think you should stay with everything.",5.201,39.731,43.794,6,20,50,"Gamble 1: Event A, Payoff: 10 tokens; Event B, Payoff: 10 tokens",1,well off,0,0,family,Yes,1,"I have both, brother(s) and sister(s)",10,No,,
66a115b150e47689843cfb8f,666729f7c7a8f940d965d7d9,2024-07-24T14:54:45.579000Z,2024-07-24T16:34:25.034000Z,86,Yes,47,Male,0,White,Netherlands,Netherlands,Netherlands,Dutch,No,Full-Time,4,95.98.50.251,414,c,1,0,0,R_3lxW3BLmuBdjTso,51.4821,4.308,EN,50 tokens,Blue,1,Yellow might be the obvious reason but I do think people can be greedy and since this study is has a flat fee people will probably pick blue anyway.,4.117,20.151,49.521,5,Yellow,Yellow,125 Tokens,50,"this is tough, you don't know what the other person will decide, I think 50 is a safe number to go for. It was already hinted at in the last few questions and I'm betting on people remembering the number 50.",6.045,9.201,43.406,2,50,100,80 tokens,0,I think in the end people will choose what will benefit them. Especially in something small like this study. I do think people will behave differently in situations with higher payouts.,4.229,5.504,38.856,2,0,50,"Gamble 1: Event A, Payoff: 10 tokens; Event B, Payoff: 10 tokens",1,well off,0,0,it's a bond I have with someone. I assosiate it most with family members.,Yes,1,I have a brother/brothers,8,No,,
66a10f3529a3ed59a175abaa,663a8253973aa879063a3c98,2024-07-24T14:29:41.487000Z,2024-07-24T16:33:15.472000Z,18,Yes,31,Male,0,Mixed,Mexico,Mexico,Mexico,Spanish,No,Full-Time,4,148.223.137.50,928,c,1,0,0,R_2aeqYChr1pfZkVv,19.1835,-96.1814,ES-ES,50 tokens,Blue,1,"Choose the option where both will have the highest reward, hoping that the other person will also choose it because the amount is higher.",2.883,117.823,121.014,9,Yellow,none,125 Tokens,50,"Do not risk more than 50% of your chips since the amount to donate to a public fund is so varied, this has a greater tendency to be unfair.",7.839,131.316,133.551,3,50,50,80 tokens,50,"By having the power to choose your payment and that of the other participant, it is fair that it be divided equally, since the work was the same for both.",9.254,57.499,59.593,2,80,50,"Gamble 1: Event A, Payoff: 10 tokens; Event B, Payoff: 10 tokens",1,well off,0,0,That you have blood ties in common.,Yes,1,I have a sister/sisters,8,No,,
66a116c070575f2e0ec4c9f4,6693f4f9d60a5f43da6b6063,2024-07-24T14:59:17.094000Z,2024-07-24T16:34:30.401000Z,42,Yes,26,Male,0,White,Portugal,Portugal,Portugal,Portuguese,Yes,Other,4,85.240.245.77,810,c,1,0,0,R_1nVcVNhTA3AcKOh,38.6244,-9.1921,PT,50 tokens,Blue,1,choose blue so both players get as much payment as possible. Choosing yellow is not favourable to both parties ,11.34,74.831,103.949,6,Blue,none,125 Tokens,100,"Contribute as much as possible so your pay will be higher. Dont be greedy, it will cost you",5.336,6.074,47.564,2,50,100,80 tokens,0,Dont allocate money to player B. You wont get as much money. Focus on you,6.787,8.777,38.121,3,0,50,"Gamble 1: Event A, Payoff: 10 tokens; Event B, Payoff: 10 tokens",1,well off,0,0,when you share a common background,Yes,1,"I have both, brother(s) and sister(s)",7,No,,
66a113da0e8f4f33970bff3d,669893b344e4613d7e01eb37,2024-07-24T14:47:08.264000Z,2024-07-24T16:33:24.682000Z,13,Yes,23,Male,0,White,Poland,Poland,Poland,Polish,No,Full-Time,1,31.183.167.249,786,c,1,0,0,R_1dt54hdd1kGMnif,51.7737,19.4767,EN,50 tokens,Blue,1,The most profitable (but risky) is the blue strategy. It provides 100 tokens if both participants choose Blue. It is logical to choose Blue then.,3.425,48.158,75.18,3,Blue,Blue,125 Tokens,100,"As contributions to the public fund grow by 50% and later on are distributed equally, it is obvious that we should contribute everything we have. We will benefit from it.",3.889,11.056,87.379,2,100,100,80 tokens,50,It is good to share equally and benefit equally. I can't think of anything else.,5.826,100.935,108.825,7,20,50,"Gamble 1: Event A, Payoff: 10 tokens; Event B, Payoff: 10 tokens",1,well off,0,0,It's my extended family and my best friends. People I can trust and who can trust me.,Yes,1,I have a sister/sisters,8,No,,
66a11ae8f62eb74ecc6265db,5d2a5458c0898e001ab08f65,2024-07-24T15:17:00.182000Z,2024-07-24T16:33:28.388000Z,1140,Yes,40,Male,0,White,United States,United States,United States,English,No,"Not in paid work (e.g. homemaker', 'retired or disabled)",2,72.198.194.35,474,c,1,0,0,R_3Getjjm1ymlNE1w,41.2884,-95.9972,EN,50 tokens,Blue,1,We make more money if we pick blue. Instead of the picking yellow which could only get 50 instead.,1.8,52.511,52.805,4,Blue,Blue,50 Tokens,50,I decided to donate half to the public fund in case the other person goes lower at least I still have 50,5.243,6.159,37.245,2,50,50,80 tokens,50,I decided just to half . I think that is the fair play here.  I am not sure what other thoughts i have,7.55,28.317,40.737,3,50,50,"Gamble 1: Event A, Payoff: 10 tokens; Event B, Payoff: 10 tokens",1,well off,0,0,It means someone you connect too,Yes,1,I have a sister/sisters,0,No,,
66a1112f5acc56e81b379eaf,5de966f5d2601a09dd32169e,2024-07-24T14:35:31.375000Z,2024-07-24T16:34:14.243000Z,3858,Yes,38,Male,0,Black,United States,United States,United States,English,No,Full-Time,5,108.64.48.207,472,c,1,0,0,R_A1jDjzhxsO4KQHT,32.7254,-97.3208,EN,50 tokens,Blue,1,It’s best to pick blue. Picking blue means that we both get the maximum payout. Picking blue seems fair,1.538,19.097,52.701,4,Blue,Blue,50 Tokens,40,It’s best to contribute what you feel is right. Always try to see how you and your partner can both benefit ,4.422,23.374,51.101,2,50,100,80 tokens,50,It’s best to allocate the amount that will benefit both parties. Benefiting both parties is fair and equal. I’m the end both parties can win,3.124,8.288,50.401,3,50,50,"Gamble 1: Event A, Payoff: 10 tokens; Event B, Payoff: 10 tokens",1,well off,0,0,"Kinship to me means family, a group of related people",Yes,1,"I have both, brother(s) and sister(s)",6,No,,
66a11527bf86c5884b4e430e,60d3648f1e9b1c33f30cd9e7,2024-07-24T14:52:51.575000Z,2024-07-24T16:34:21.712000Z,1220,Yes,43,Male,0,Mixed,United States,United States,United States,English,No,Part-Time,5,172.56.208.113,982,c,1,0,0,R_AbNCHwx2pdzp6i5,36.2158,-115.066,EN,50 tokens,Blue,1,"My thought process is that picking yellow each time is a sure thing, however, if someone is looking to make more money then they must take a risk by choosing blue.  I figured i would just start with blue and get hope the other person starts with it too.",8.687,191.617,192.478,8,Yellow,Yellow,50 Tokens,50,Personally I think that half is a safe bet. I don't want to be greedy and I don't want to give up all monies either.,5.197,208.727,215.376,10,25,50,80 tokens,50,"Again, if allocating between 2 people, the division should be equal.  No need to be greedy.",5.362,79.437,80.133,8,50,50,"Gamble 1: Event A, Payoff: 10 tokens; Event B, Payoff: 10 tokens",1,well off,0,0,Another word for family and close friends.,Yes,1,"I have both, brother(s) and sister(s)",7,No,,
66a10eee83d871d836c65cb0,6508529792d8fe05e9127c3d,2024-07-24T14:28:31.503000Z,2024-07-24T16:33:09.347000Z,46,Yes,18,Male,0,Other,Mexico,Mexico,Mexico,Spanish,No,Full-Time,4,189.141.52.247,728,c,1,0,0,R_vH5aGdjDksfmlc5,20.7417,-100.4472,ES-ES,50 tokens,Blue,1,"I like to think about the general good more than the personal one, if one of the options benefits me and another player, I consider them more attractive.",1.995,64.473,65.347,4,Blue,Blue,125 Tokens,100,"The same as in the last answer, if I can ensure a profit for the common good rather than a personal one, I will always take it.",3.469,38.919,39.403,5,50,100,80 tokens,50,I like that it is fair and that if I win someone else can win too,8.95,38.937,40.07,2,20,50,"Gamble 1: Event A, Payoff: 10 tokens; Event B, Payoff: 10 tokens",1,well off,0,0,something familiar,Yes,1,"I have both, brother(s) and sister(s)",10,No,,
66a10f57464b3875f0b27ae9,66338f7bfb894c5829528792,2024-07-24T14:27:39.651000Z,2024-07-24T16:33:17.147000Z,7,Yes,20,Male,0,White,Mexico,Mexico,Mexico,Spanish,Yes,Other,4,189.172.121.74,705,c,1,0,0,R_25F86tafLVjvPlL,20.975,-89.6128,ES-ES,50 tokens,Blue,1,"Choose the option where both earn more money, hoping that your partner would do the same ",1.964,60.509,85.913,7,Blue,Blue,125 Tokens,50,"The instructions are a little more difficult, so I think the better way is to go safe and put the half of the tokens ",15.893,65.784,73.874,4,30,100,80 tokens,50,"make an equitable decision, hoping that the other person does the same",5.508,38.144,50.858,4,25,50,"Gamble 1: Event A, Payoff: 10 tokens; Event B, Payoff: 10 tokens",1,well off,0,0,it means the people I am relate it to ,Yes,1,"I have both, brother(s) and sister(s)",7,No,,
66a11764e0ea8951ba2a8d58,666ee7c7a67b80f5bd4c25cf,2024-07-24T15:02:46.430000Z,2024-07-24T16:34:32.896000Z,53,Yes,28,Male,0,White,Mexico,Mexico,Mexico,Spanish,Yes,Unemployed (and job seeking),4,177.240.200.130,693,c,1,0,0,R_YRGaLZnKjiQNBId,19.0631,-98.2217,EN,50 tokens,Blue,1,"Although it depends on what your counterpart selects, is better to go for the better reward",3.919,60.164,100.462,13,Blue,Blue,125 Tokens,50,"Put at most 50 percent of your tokens to the public fond, don´t put everything cause might a posibility that you lose tokens",8.495,15.847,76.924,3,50,50,80 tokens,50,"Giving the half of the tokens to the role b is the correct action, the only way for the role b to make some profit is whatever you want to give, so the best thing is give an equal profit",8.065,91.004,91.219,4,51,50,"Gamble 1: Event A, Payoff: 10 tokens; Event B, Payoff: 10 tokens",1,well off,0,0,Is some kind of relation that you have with another person,Yes,1,"I have both, brother(s) and sister(s)",8,No,,
66a10f3a4eb49767e17d9a22,668aa067edd91f3ef0a579bb,2024-07-24T14:27:17.639000Z,2024-07-24T16:33:15.770000Z,9,Yes,20,Male,0,Mixed,Mexico,Mexico,Mexico,Spanish,No,Full-Time,4,189.162.193.65,576,c,1,0,0,R_1d4hiVDQyHRIvnW,21.1118,-101.723,ES-ES,50 tokens,Blue,1,"Yo creo que ambas partes deben ganar, por eso mismo eso mismo yo escogí la que creo que es la mejor opción para ambos y nos den una bonificación de tokens mayor ",1.635,68.122,69.508,12,Yellow,Blue,100 Tokens,50,"yo di la mitad de mi ganancia para que si alguien más piensa como yo, nos toque de más recompensa para todos ",9.031,70.441,70.867,18,20,30,80 tokens,50,"Que nos toque equitativamente la misma cantidad de tokens, por eso yo daría eso porque si fuera al revés quisiera eso",7.332,29.705,48.135,6,50,50,"Gamble 1: Event A, Payoff: 10 tokens; Event B, Payoff: 10 tokens",1,well off,0,0,"Que te parezcas a tus familiares, ya sea valores, físicamente y en algunas formas de hacerlas cosas o de pensar ",Yes,1,"I have both, brother(s) and sister(s)",8,No,,
6459946ed4037da0c36923b8,577f70d1454e5400015f1845,2023-05-09T00:31:46.310000Z,2023-05-09T01:51:15.786000,4581,Yes,63,Male,0,Black,South Africa,South Africa,South Africa,Other,Yes,Other,4,102.39.203.235,436,c,1,0,0,R_T1PfrDsV1TS6Zep,-26.3811,27.8376,EN,100 tokens,Blue,1,Please choose the one with more tokens as it give you a better reward,4.195,29.983,39.362,8,Blue,none,50 Tokens,100,Please choose the highest contribution as it makes the reward better,6.742,26.563,33.727,5,100,100,80 tokens,99,For a better reward please choose the highest allocation of tokens,3.611,5.723,25.595,3,100,50,"Gamble 1: Event A, Payoff: 10 tokens; Event B, Payoff: 10 tokens",1,well off,0,0,The next of kin ,Yes,1,"I have both, brother(s) and sister(s)",5,Yes,Yes,10
6459750c5f2c8a3325e86c87,5c17cd8cd53890000141bb64,2023-05-08T22:17:48.274000Z,2023-05-09T00:31:11.504000,94,Yes,22,Male,0,Asian,India,United States,United States,English,No,Full-Time,2,73.124.129.229,515,c,1,0,0,R_2ve5foGWec6sQLy,25.992,-80.2702,EN,50 tokens,Blue,1,"If we work together and both choose blue, we can each get the maximum of 100 tokens.",2.507,36.645,38.318,5,Blue,Blue,100 Tokens,50,You will maximize the amount you and your partner receive of you select to put 50 tokens in the public fund.,9.364,85.549,91.95,14,50,50,80 tokens,0,"If you are in Role A, you should keep all of your tokens to maximize your payoff.",2.822,12.08,35.457,5,0,50,"Gamble 1: Event A, Payoff: 10 tokens; Event B, Payoff: 10 tokens",1,well off,0,0,Kinship means sharing a common goal.,Yes,1,I have a sister/sisters,9,No,,
6459758a61493ef1c7015513,5cb10888e25ee40018e49d48,2023-05-08T22:20:04.936000Z,2023-05-09T00:31:12.892000,263,Yes,58,Male,0,White,Australia,Australia,Australia,English,Yes,Other,4,118.210.115.39,591,c,1,0,0,R_1kFAEID6A7LMYK7,-33.8715,151.2006,EN,50 tokens,Blue,1,"Honestly, i just prefer the colour blue and it provided both the team mates with more tokens",2.637,39.937,63.316,7,Blue,Blue,100 Tokens,50,"well by my understanding you gain more tokens by allocating 50, so its a more viable option",5.256,46.053,59.963,3,50,100,80 tokens,50,"i feel as if providing an even playing field is normal, by both receiving the same amount it ensures that we both get the benefits, equality is important ",6.149,67.74,101.525,6,50,50,"Gamble 1: Event A, Payoff: 10 tokens; Event B, Payoff: 10 tokens",1,well off,0,0,"family, connectedness, a descendent of a person ",Yes,1,I have a sister/sisters,8,No,,
6459773afd3be8fac99e838e,5ee43a8e2ec5ba13df088f5e,2023-05-08T22:27:06.710000Z,2023-05-09T00:31:23.253000,519,Yes,45,Male,0,White,United States,United States,United States,English,No,"Not in paid work (e.g. homemaker', 'retired or disabled)",5,69.117.54.191,679,c,1,0,0,R_3MuSQopiQTTyRrE,41.1811,-73.1735,EN,50 tokens,Blue,1,Trying to maximize rewards for us both. Therfore i hope my playing compatriot also has the same motivation.  It would be grwat for both of us to come out ahead.,11.64,112.998,113.813,7,Blue,Blue,50 Tokens,100,I want yo maximize rewards for both of the players. I think and hope my playing oartner does too.,5.676,59.064,59.603,3,100,100,80 tokens,50,We are equally rewarded.we are equally at risk. Sharingbis a good thing.,12.418,62.418,62.901,6,50,50,"Gamble 1: Event A, Payoff: 10 tokens; Event B, Payoff: 10 tokens",1,well off,0,0,"Related by blood or like feelings,beliefs and mores, or morality ",Yes,1,"I have both, brother(s) and sister(s)",3,No,,
645976a5dccc568a2b59df9e,5f0407d8f388fe627e377aad,2023-05-08T22:24:49.316000Z,2023-05-09T00:31:18.679000,53,Yes,47,Male,0,Black,South Africa,South Africa,South Africa,English,Yes,Part-Time,4,105.27.171.94,804,c,1,0,0,R_2ScyJUVckcywccZ,-25.7599,28.2604,EN,50 tokens,Blue,1,Choose blue to get more tokens to get 100 tokens which will increase your payoffs,4.687,40.109,68.345,7,Blue,Blue,50 Tokens,50,contributing to the public will guarantee you get a share of your contribution,6.654,45.107,109.075,8,52,60,80 tokens,10,Do not allocate more tokens to role b as that will reduce your payout,7.144,12.179,44.907,4,0,50,"Gamble 1: Event A, Payoff: 10 tokens; Event B, Payoff: 10 tokens",1,well off,0,0,family relationships,Yes,1,I have a brother/brothers,9,No,,
64598ffb5b4357d04d97d2c7,5f879df674a3c81e20a40cd6,2023-05-09T00:12:47.395000Z,2023-05-09T01:51:10.374000,1228,Yes,28,Male,0,Black,South Africa,South Africa,South Africa,English,Yes,Full-Time,4,41.87.216.224,1629,c,1,0,0,R_D0pOSMyt78Qr1At,-29.9056,30.9405,EN,100 tokens,Blue,1,Read the instructions properly. Please make sure that you think before playing the game. Also make sure you observe.,4.545,130.878,138.938,8,Blue,Yellow,50 Tokens,30,"When playing the game try to think what people who are playing will randomly choose,",6.555,254.08,255.106,13,50,100,80 tokens,40,Read everything correctly or carefully to not get everything wrong.,3.723,121.486,174.029,11,50,50,"Gamble 1: Event A, Payoff: 10 tokens; Event B, Payoff: 10 tokens",1,well off,0,0,love,Yes,1,I have a sister/sisters,7,No,,
