Submission id,id,Started at,Reviewed at,Total approvals,Siblings,Age,Sex,female,Ethnicity,Countryofbirth,Country of residence,Nationality,Language,Student status,Employment status,session,IPAddress,Duration,Treatment,control,t1,t2,ResponseId,LocationLatitude,LocationLongitude,UserLanguage,Q6 Comp,Action1,blue,Advice1,timer action 1_First Click,timer action 1_Last Click,pagetimerSH,timer action 1_Click Count,Dnorm1,Snorm1,Comp2,Action2,Advice2,Timer action 2 _First Click,Timer action 2 _Last Click,pagetimerPGG,Timer action 2 _Click Count,DNorm2,SNorm2,Comp3,Action3,Advice3,Timer action 3 _First Click,Timer action 3 _Last Click,pagetimerDic,Timer action 3 _Click Count,DNorm3,SNorm3,Lotteries,risktolerance,wealth,poor,lowerincome,describe kinship ,sibling ,hassibling,Kin,closeness,Service,kin2,close2
66a1108842d69d3c242da446,6030d5fc2e34a2f6711b76f0,2024-07-24T14:32:40.723000Z,2024-07-24T16:31:52.531000Z,90,No,22,Male,0,White,United Kingdom,United Kingdom,United Kingdom,English,No,Full-Time,3,109.159.35.158,508,2,0,0,1,R_21bFd5xNn63OGL9,52.7012,-1.8763,EN,50 tokens,Yellow,0,Choose the option that is guaranteed to deliver a return and has no risk,4.046,4.046,23.412,1,Blue,Blue,100 Tokens,50,"Make a fair assessment based on risk - if you want to be sure to gain something in return, avoid giving all your funds away",5.291,22.246,39.073,3,50,50,80 tokens,20,Base your tokens on how much risk you are willing to accept and the likelihood of receiving a good result,8.752,43.308,46.416,3,80,20,"Gamble 1: Event A, Payoff: 10 tokens; Event B, Payoff: 10 tokens",1,not well off,0,1,Feeling a sense of belonging and understanding with another person or group of people,Yes,1,"I have both, brother(s) and sister(s)",0,No,,
66a10f93166352b30bfd632d,666ee913519a8d810a4c38d9,2024-07-24T14:29:37.432000Z,2024-07-24T16:31:46.965000Z,16,No,28,Male,0,Black,South Africa,South Africa,South Africa,English,No,Unemployed (and job seeking),3,102.219.162.223,774,2,0,0,1,R_2XNAhLcus3EW68V,-26.2309,28.0583,EN,50 tokens,Yellow,0,"Well if there is a guaranteed prize., that's the color we are going to go for ",2.431,66.211,70.638,6,Yellow,Yellow,100 Tokens,50,For a sum of 100 it makes sense that I contribute 50. This seems like a fair thing to do ,8.441,51.031,65.092,7,51,100,80 tokens,20,"From the provided information, you need to allow that to guide you on how much to add or minus",10.681,18.879,68.281,3,40,81,"Gamble 1: Event A, Payoff: 10 tokens; Event B, Payoff: 10 tokens",1,not well off,0,1,Bloodline,Yes,1,I have a brother/brothers,7,No,,
66a117b398505426a984f383,669deaeb9c7863cefe2072d10,2024-07-24T15:03:21.436000Z,2024-07-24T16:34:34.758000Z,86,No,41,Male,0,White,Norway,Norway,Norway,Norwegian,No,Part-Time,4,141.0.76.87,439,2,0,0,1,R_8BxMM2MEsBOFn6H,60.3963,5.3214,EN,50 tokens,Yellow,0,"If the intention is to amass tokens, and choosing Yellow guarantees a 50 Token payoff for both players, the best strategy is to always pick Yellow.",6.172,6.172,51.886,1,Yellow,Yellow,100 Tokens,50,"Contribue 50, and hope your counterpart does the same. Either way, you are left with 50 tokens, it is better than nothing.",8.063,9.03,35.778,2,50,50,80 tokens,50,"Allocating half is the only fair way to go about it. Keeping emotion and greed out of it, it is split right down the middle, best outcome for either one.",7.678,42.628,43.642,3,50,50,"Gamble 1: Event A, Payoff: 10 tokens; Event B, Payoff: 10 tokens",1,not well off,0,1,"Family, or people who share the same ideologies and values as you.",Yes,1,I have a sister/sisters,9,No,,
64599527d9a8df28bbdba131,5a94c0b7b5e2110001c6891e,2023-05-09T00:34:51.569000Z,2023-05-09T01:51:34.037000,5707,No,50,Male,0,White,United States,United States,United States,English,No,Full-Time,4,73.224.57.240,809,2,0,0,1,R_7ZDdYcwVH4c7itO,30.1918,-81.6028,EN,50 tokens,Yellow,0,Choose Yellow. I think this is the best way to go given the odds of winning,5.262,70.754,78.268,15,Blue,none,125 Tokens,50,I would contribute 50 tokens based on what we have been told so far of what the odds are ,3.869,147.785,155.668,32,50,50,80 tokens,79,Play the 80 tokens as the instructions said to do. This is the best way to go. ,15.305,83.478,98.201,12,80,80,"Gamble 1: Event A, Payoff: 10 tokens; Event B, Payoff: 10 tokens",1,not well off,0,1,Family members ,Yes,1,I have a sister/sisters,3,No,,
6459673992adb5983c139d26,601b154e1d236c48cb675d13,2023-05-08T21:18:49.167000Z,2023-05-08T21:50:44.582000,35,No,40,Male,0,Asian,United States,United States,United States,Vietnamese,No,Part-Time,1,50.235.93.242,401,2,0,0,1,R_2I6w2O9qNs3HfYR,34.2503,-85.1443,EN,100 tokens,Yellow,0,Try not to be greedy when making a selection and hope that the other player has the same mindset. ,10.738,29.414,43.283,2,Yellow,Yellow,50 Tokens,49,Try not to be greedy but save some for yourself as well. Be a kind person. ,6.947,9.822,33.421,2,50,50,80 tokens,50,Give the other player a fair chance at the game as well. Needs to be fair. ,5.977,6.677,25.695,2,50,50,"Gamble 2: Event A, Payoff: 18 tokens; Event B, Payoff: 6 tokens",2,not well off,0,1,Brotherhood or being close with family members. This does extend to friends as well. ,Yes,1,I have a sister/sisters,9,No,,
645965f0409831b89bf2cf4c,602d058e7597b066193f8bbf,2023-05-08T21:14:45.211000Z,2023-05-08T21:50:41.715000,210,No,21,Male,0,White,United States,United States,United States,English,No,Full-Time,2,41.144.101.13,725,2,0,0,1,R_2eX0LGCCUyc5DHE,-29.8556,31.0449,EN,50 tokens,Yellow,0,The best way is to play this game is to choose an option that will guarantee you a win no matter what you might have chosen.,6.886,6.886,80.095,1,Yellow,Blue,100 Tokens,50,is to try and think about how will the other player will be playing to win the game. To maximise any opportunity of winning the game.,8.938,91.168,93.758,4,18,50,80 tokens,30,To make sure that you do not give out all of your tokens to other group.,6.8,43.731,46.435,3,20,40,"Gamble 2: Event A, Payoff: 18 tokens; Event B, Payoff: 6 tokens",2,not well off,0,1,To have a blood relation with someone.,Yes,1,"I have both, brother(s) and sister(s)",8,No,,
6459673e849acb4e52f6e1bd,602d3141c32cfe6eaa98b817,2023-05-08T21:18:54.746000Z,2023-05-08T21:50:44.864000,349,No,23,Male,0,White,United Kingdom,United Kingdom,United Kingdom,English,No,Full-Time,2,86.17.205.192,570,2,0,0,1,R_2Rgv5wtjG1YmFqG,54.9352,-1.5675,EN,50 tokens,Yellow,0,I believe a selfish person is less likely to have siblings as they'd not have needed to share toys or experiences as they were growing up and forming their identity as a person ,3.806,3.806,40.435,1,Yellow,Blue,50 Tokens,50,I wouldn't invest it all as I think a person with no siblings would be used to sharing investment opportunities. I think sole ventures would be more likely to appeal to them and their experience with needing to trust others. Therefore as said I'd be willing to invest some but not risk all of my tokens,4.069,113.246,113.678,11,50,100,80 tokens,40,"I'd look after yourself before looking after others, but still provide them with some level of reward. I feel this is fair to yourself whilst avoiding the guilt of being a selfish person. If the shoe was on the other foot, I'd basically approach this in a way that makes me more fair than the average person doing the same task. ",18.814,86.61,86.9,8,0,50,"Gamble 2: Event A, Payoff: 18 tokens; Event B, Payoff: 6 tokens",2,not well off,0,1,A family like relationship where people look out for one another ,Yes,1,I have a sister/sisters,8,No,,
645977697c87ec890f2ff449,6113cd5e3287b5f60b4c40f8,2023-05-08T22:28:00.731000Z,2023-05-09T00:31:25.719000,171,Yes,20,Male,0,White,United States,United States,Italy,English,No,Full-Time,4,108.30.232.184,337,2,0,0,1,R_5vjDNfCY7O1dvD5,40.5468,-74.1804,EN,50 tokens,Yellow,0,Select yellow because it is gauranteed to get you tokens so it is your best bet.,1.696,15.38,20.812,2,Yellow,none,100 Tokens,50,I would contribute as you will get the tokens back which is the goal.,3.922,36.537,38.849,8,52,,80 tokens,30,I want to allocate some tokens to the other person but I want to keep a majority to myself.,8.705,9.926,24.636,2,50,50,"Gamble 2: Event A, Payoff: 18 tokens; Event B, Payoff: 6 tokens",2,not well off,0,1,Family members,Yes,1,I have a brother/brothers,7,No,,
6459dd8df709911b14bae7d8,62912f1dcd620b716c282102,2023-05-09T05:43:44.368000Z,2023-05-09T14:11:47.942000,105,No,20,Male,0,Black,United States,United States,United States,English,No,Part-Time,4,174.80.147.131,530,2,0,0,1,R_6PHoKBV3FgVnK30,34.0114,-85.2471,EN,100 tokens,Yellow,0,Read the directions slowly and carefully. Pay attention to what you read!,5.456,6.374,34.175,2,Yellow,none,100 Tokens,55,I approached giving my best estimate I may or may not be right. It could go either way but honestly probably higher up on the dial than not.,4.492,111.29,112.649,31,50,60,80 tokens,20,100 token total between two players. Player A is in charge of distributing the 100 tokens between the two ( A and B player) ,3.917,27.249,82.401,10,30,50,"Gamble 2: Event A, Payoff: 18 tokens; Event B, Payoff: 6 tokens",2,not well off,0,1,"as I۪m genetically alike. blood relatives, mother and son , twin sister ",Yes,1,"I have both, brother(s) and sister(s)",6,No,,
645992ab318e93f590bae7da,633b87cee034f7bf70e3faa5,2023-05-09T00:24:14.457000Z,2023-05-09T01:51:13.363000,694,Yes,27,Male,0,White,United States,United States,United States,English,Yes,Part-Time,3,166.198.34.87,663,2,0,0,1,R_3nIe1njMH9VuF8l,38.5148,-121.4395,EN,50 tokens,Yellow,0,"My best advice to play is to choose yellow. If both players choose yellow then both participants will receive at least 50 tokens, no matter what each person picks. It would be wise to choose yellow because at least there is a good chance of winning. ",21.412,21.412,120.108,1,Yellow,Blue,100 Tokens,50,It۪s safest to put up at least 50 tokens because the amount will be matched by what the other person puts in. And it will also grow by 50% which increases the payout for each participant. ,8.971,18.612,100.445,4,87,44,80 tokens,24,"My best advice to put the least amount of tokens in if your are role A. The more tokens you put in, the less tokens you will receive. Putting in less tokens ensures you will have more tokens at the end. ",6.656,68.826,69.964,7,15,7,"Gamble 3 Event A, Payoff: 26 tokens ; Event B, Payoff: 2 tokens",3,not well off,0,1,Kinship means the bond and relationship between people in your life. ,Yes,1,"I have both, brother(s) and sister(s)",5,No,,
64599814af8cd8d9da139cf7,640da58d1ce7d6bee643de7b,2023-05-09T00:47:20.826000Z,2023-05-09T01:51:35.016000,339,No,19,Male,0,Asian,Sri Lanka,Canada,Canada,English,No,Full-Time,3,99.232.116.143,712,2,0,0,1,R_13fnPU3WU0dGOwr,43.8594,-79.1633,EN,50 tokens,Yellow,0,"It is advised that you read the scenario appropriately before beginning. If either of you choose Yellow, that individual will receive 50 tokens. If you both choose Blue, both will receive 100 tokens. If you choose Blue and the other chooses Yellow, there will be zero tokens given and the one who chose yellow will receive 50 tokens. ",6.801,140.495,144.272,4,Yellow,Blue,100 Tokens,50,You have 100 tokens. Your contribution and your conunterparts contributions to the public fund will increase by 50%. You contribute 50 tokens and so does your counterpart. The sum of the final pot is how much you did not contribute plus how much you contributed.,13.7,119.358,121.038,6,50,100,80 tokens,80,This game is based on allocation. Read the amounts carefully as Role A and Role B. Allocation would be at 80 tokens.,3.737,5.77,41.403,2,80,100,"Gamble 4: Event A, Payoff: 34 tokens; Event B, Payoff: - 2 tokens",4,not well off,0,1,Family,Yes,1,I have a sister/sisters,9,No,,
6459980d9ee3874c37692387,64282ae044d37e83e83ceca5,2023-05-09T00:47:12.684000Z,2023-05-09T01:51:34.881000,254,No,25,Male,0,White,United States,United States,United States,English,Yes,Full-Time,1,173.52.239.86,670,2,0,0,1,R_6XtUEWc8REVEmvD,40.9673,-73.8418,EN,50 tokens,Yellow,0,Ill do yellow twice then blue. I think that equals out to 100 each.,2.596,42.239,42.93,5,Yellow,none,125 Tokens,50,Put 50 in first then go up or down depending on what they do. If they match then id go up to 100,8.395,66.652,85.002,4,50,50,80 tokens,50,"im not sure if there is a best way to play this one, I think its just dependent on how much you want to take for your self",3.554,26.84,88.295,4,50,50,"Gamble 5 Event A, Payoff: 42 tokens; Event B, Payoff: -6 tokens",5,not well off,0,1,The relationships i have with people who are related to me by blood,Yes,1,I have a brother/brothers,2,No,,
6459664bffb53ec24570abab,5e2cf87d49436731eac78e46,2023-05-08T21:14:51.512000Z,2023-05-08T21:50:42.577000,456,No,40,Male,0,Black,South Africa,South Africa,South Africa,Other,Yes,Full-Time,2,41.122.70.24,1088,2,0,0,1,R_8OOfWlYc8V1x1yZ,-29.8556,31.0449,EN,50 tokens,Yellow,0,always choose the colour yellow. it guarantees you 50tokens whether the other person chooses another colour.,13.405,88.954,121.994,3,Blue,Yellow,125 Tokens,50,Play it safe and contribute half of your tokens. you are bound to get a return of more than 40%,19.051,73.466,147.765,4,100,100,80 tokens,49,in this action you're being tested your level of greediness. well be greedy I have no other honest advice for you.,14.595,88.83,124.406,8,50,100,"Gamble 5 Event A, Payoff: 42 tokens; Event B, Payoff: -6 tokens",5,not well off,0,1,it is the characteristics of bonds between you and your family members.,Yes,1,"I have both, brother(s) and sister(s)",9,No,,
64596488cd47f74436c95df5,5ef7c592ae02864f768524cf,2023-05-08T21:07:30.917000Z,2023-05-08T21:50:39.520000,47,No,39,Male,0,White,United Kingdom,United Kingdom,United Kingdom,English,No,Full-Time,3,92.22.104.245,674,2,0,0,1,R_8jpSBTZhEiE7uTY,53.5082,-2.2648,EN,100 tokens,Yellow,0,If you choose yellow you're 100% likely to get tokens. You may gamble and choose blue but you may come away with nothing. You are risking the other participant getting no tokens though,2.06,51.727,92.714,5,Blue,Blue,100 Tokens,5,It makes sense to contribute a few tokens. By contributing a few you will get a share of the public tokens. ,8.234,47.167,74.411,6,10,25,80 tokens,35,If you are Role A you will only lose tokens. It is up to you morally I guess,2.82,4.584,23.3,2,20,50,"Gamble 5 Event A, Payoff: 42 tokens; Event B, Payoff: -6 tokens",5,not well off,0,1,"Family, blood or not. The people you hold dear to you in life. ",Yes,1,I have a brother/brothers,3,No,,
645982177f7b13c4a8dfc4b9,5a443703daea400001ac2859,2023-05-08T23:13:32.752000Z,2023-05-09T01:51:06.543000,1484,Yes,26,Male,0,White,Poland,United Kingdom,United Kingdom,Polish,No,"Not in paid work (e.g. homemaker', 'retired or disabled)",1,2.100.53.73,812,2,0,0,1,R_2PUeXqk0eM2Avol,55.8557,-4.2104,EN,50 tokens,Blue,1,"As this is my first time playing this game, I don't consider myself an expert in what strategy you should choose. I am a person who trusts people, so I chose the blue syrategy, believing that the person on the other side would also do the same.",9.513,133.565,134.206,3,Blue,Blue,100 Tokens,30,"I'm not an expert in human behavior, and my partner in the game has no siblings, so theoretically he has a tendency to be selfish, so I played more carefully this time, which I recommend to you as well.",8.682,112.881,113.367,5,25,50,80 tokens,50,"This time, the entire responsibility for our joint income was placed in my hands. So I decided to behave in order and divide the tokens evenly. I believe this was the right thing to do.",7.062,119.077,120.925,5,40,50,"Gamble 1: Event A, Payoff: 10 tokens; Event B, Payoff: 10 tokens",1,poor,1,1,This is a situation in which me and the other person come from the same family,Yes,1,"I have both, brother(s) and sister(s)",3,No,,
645975ab37d8ed05e4f5494b,5b575632e62cbe000197b9d7,2023-05-08T22:20:27.748000Z,2023-05-09T00:31:13.617000,123,Yes,25,Male,0,White,United States,United States,United States,English,No,"Not in paid work (e.g. homemaker', 'retired or disabled)",1,35.150.212.192,313,2,0,0,1,R_1qF1J0hZfxZfDyl,34.7666,-84.9848,EN,50 tokens,Blue,1,You need to follow your gut. This should be fairly easy. I think you can't think too much or you'll make mistakes.,10.046,10.046,60.879,1,Yellow,none,100 Tokens,10,"Trust your gut in this. You will benefit in the end. It will be hard at times, but try your best.",4.498,24.194,34.722,3,15,10,80 tokens,10,Make sure to read this a few times. Do not put a lot on the line. Your gut is right most of the time.,8.427,13.559,40.565,2,12,10,"Gamble 1: Event A, Payoff: 10 tokens; Event B, Payoff: 10 tokens",1,poor,1,1,This means someone who is there for you and you are there for them. ,Yes,1,I have a sister/sisters,3,No,,
64597767733b8133dff8d835,5b7859413c1375000197d844,2023-05-08T22:28:00.678000Z,2023-05-09T00:31:25.553000,1018,Yes,53,Male,0,White,United States,United States,United States,English,No,Unemployed (and job seeking),4,24.30.58.188,447,2,0,0,1,R_5WcdXqKJpdXvCWl,34.0389,-84.3826,EN,50 tokens,Blue,1,Hope that people are good and you both choose blue dont be greedy or try to play safe by choosing yellow ,1.346,20.752,35.837,2,Blue,Blue,125 Tokens,100,if you donate all your funds and so does everyone else everyones money will grow ,3,43.493,43.7,6,100,100,80 tokens,50,be fair and split those tokens 50/50 its what anyone good would do ,3.521,4.887,28.699,2,50,50,"Gamble 1: Event A, Payoff: 10 tokens; Event B, Payoff: 10 tokens",1,poor,1,1,Its the people you surround yourself with its the family you have regardless of blood the ones you know will be there for you ,Yes,1,"I have both, brother(s) and sister(s)",6,No,,
64597d1ad2ff4b4e1e69238e,5d618a9955fc54000164673f,2023-05-08T22:52:13.564000Z,2023-05-09T01:51:05.193000,300,Yes,48,Male,0,Other,United States,United Kingdom,United Kingdom,English,Yes,Part-Time,4,5.151.178.168,456,2,0,0,1,R_20qMA7kG6ajQBXa,51.6539,-0.0888,EN,50 tokens,Blue,1,The safest option must be to choose option Yellow. It's a naturally collaborative approach.,4.544,4.544,36.123,1,Blue,Blue,125 Tokens,45,Don't gamble excessively on this challenge. Consider the value of your existing income.,17.819,47.543,55.94,3,50,100,80 tokens,50,I will fairly distribute the tokens between both parties. I feel this is good-natured for our participations.,8.657,9.768,44.164,2,50,50,"Gamble 1: Event A, Payoff: 10 tokens; Event B, Payoff: 10 tokens",1,poor,1,1,A friendly bond with another person; usually implying closeness.,Yes,1,I have a sister/sisters,5,No,,
6459775a90b7bfb53c005799,5ee0c681fe11e60551560cd8,2023-05-08T22:27:45.506000Z,2023-05-09T00:31:25.058000,107,Yes,30,Male,0,Black,South Africa,South Africa,South Africa,English,Yes,Unemployed (and job seeking),2,105.245.56.150,855,2,0,0,1,R_8I6LGYocziEe0RE,-26.2309,28.0583,EN,50 tokens,Blue,1,I think you should choose blue throughout as I will do likewise in order for both of us to receive more tokens. I will also do likewise choose the blue.,15.152,83.088,83.578,2,Blue,Blue,125 Tokens,61,I think we should contribute more than 50 % of our individual contributions so we can have enough payout by the end,15.194,25.214,74.09,6,71,60,80 tokens,5,I think the best way possible is to allocate the token in such a way that it is reasonable to the counterpart also,10.952,20.567,74.5,3,30,51,"Gamble 5 Event A, Payoff: 42 tokens; Event B, Payoff: -6 tokens",5,poor,1,1,Lovely relationship ,Yes,1,"I have both, brother(s) and sister(s)",2,No,,
6459773e00abd4c9c49f7919,5f934d57b31a3a10b0631ae7,2023-05-08T22:27:09.989000Z,2023-05-09T00:31:23.575000,379,Yes,30,Male,0,White,United States,United States,United States,English,No,Full-Time,3,12.198.122.136,631,2,0,0,1,R_20pefqbKQmoUaLS,29.5738,-98.2292,EN,50 tokens,Blue,1,Choose blue as it is the most beneficial to both parties. The is no negative and both sides get the max payout. I think all partied would choose blue unless they don't understand the instructions,14.891,89.503,91.071,10,Blue,Blue,50 Tokens,100,Going all in maximizes your payout. ID assume they would do the same. only greed would have them not go all in.,3.501,6.507,58.914,2,100,100,80 tokens,50,50 tokens is the logical choice. I would go all in but half is the safe choice. I think this is the top choice among participants.,10.226,67.65,69.13,5,50,50,"Gamble 5 Event A, Payoff: 42 tokens; Event B, Payoff: -6 tokens",5,poor,1,1,In relation to like a relative or well know person to yourself.,Yes,1,"I have both, brother(s) and sister(s)",7,Yes,Yes,6
645975d38918206545c2d4db,5fae721319e73f2ff0c6605a,2023-05-08T22:21:07.705000Z,2023-05-09T00:31:13.926000,173,Yes,21,Male,0,White,United Kingdom,United Kingdom,United Kingdom,English,No,Full-Time,4,149.22.94.49,1195,2,0,0,1,R_6ojUfx0LN2Ef77X,33.7485,-84.3871,EN,50 tokens,Blue,1,Always choose blue for more because it seems to be a more likely choice. ,1.871,17.975,38.046,2,Blue,Blue,125 Tokens,100,"There's  no telling if and  how much the other party will contribute. Therefore the safest bet is to donate nothing unless one is comfortable with loss. However, the other side could give all and if you both do, that would result in a gain of 50. ",12.529,375.421,386.238,9,,100,80 tokens,50,"This would distrubte the funds equally. Therefore, this would be the most fair way to do it. Some may not want fair however what do you want?",36.438,126.481,127.31,3,50,50,"Gamble 5 Event A, Payoff: 42 tokens; Event B, Payoff: -6 tokens",5,poor,1,1,It means unity through blood and more. ,Yes,1,"I have both, brother(s) and sister(s)",2,No,,
64599b2eacb24cbe4045afbe,63d71e67dd0fcccd3cc745b0,2023-05-09T01:00:52.286000Z,2023-05-09T01:51:17.492000,713,Yes,33,Male,0,White,Poland,Poland,Poland,Polish,No,Full-Time,1,89.200.227.48,1121,2,0,0,1,R_8pE5FH2CKJV9wJ3,50.0914,18.5385,EN,50 tokens,Yellow,0,I think it's best to choose yellow all the time. A safe option for profit,8.383,48.383,50.2,1,Yellow,Blue,125 Tokens,10,"people are too greedy nowadays, it's not worth contributing. Sometimes it's worth thinking only about yourself without looking at the good of others",6.538,284.871,325.72,11,0,100,80 tokens,43," Sometimes it is worth looking only for your own good, even if it is at the expense of another person",2.733,121.248,122.616,3,0,50,"Gamble 1: Event A, Payoff: 10 tokens; Event B, Payoff: 10 tokens",1,poor,1,1,for me it simply means only biological relatedness,Yes,1,I have a sister/sisters,5,No,,
64597e462adb92c18cdfc4b0,6075848404073601c3294741,2023-05-08T22:57:10.367000Z,2023-05-09T00:31:27.610000,95,Yes,21,Male,0,White,United States,United States,United States,English,No,Part-Time,4,174.106.153.225,374,2,0,0,1,R_5rWK2Tni5iyjLlT,34.4396,-77.9212,EN,50 tokens,Yellow,0,Always pick the method that produces an that benefits both paticipants the most,3.995,24.719,28.011,5,Yellow,Blue,100 Tokens,50,Always make the choice that benefits both participants the most as it is the maximum reward most likely,2.268,14.877,37.929,4,50,50,80 tokens,0,Take everything because there is no chance that the participant in Role B can reciprocate,6.17,34.766,35.062,4,0,50,"Gamble 1: Event A, Payoff: 10 tokens; Event B, Payoff: 10 tokens",1,poor,1,1,kinship means being a solid foundation for your friends and family. it means being there for others.,Yes,1,I have a brother/brothers,6,No,,
64597729269d86f369441466,60cf3bb82757728b125c0311,2023-05-08T22:26:59.813000Z,2023-05-09T00:31:22.274000,33,Yes,27,Male,0,White,Romania,United Kingdom,Romania,Romanian,No,"Not in paid work (e.g. homemaker', 'retired or disabled)",4,82.5.62.145,704,2,0,0,1,R_8zGgFZQhU4unriH,52.4259,-1.4628,EN,50 tokens,Yellow,0,"Do not give up! If you lost once, try again. You will win in the end.",13.635,13.635,78.895,1,Yellow,Yellow,100 Tokens,52,Do not give up and will be succesfull after all. I have started fron scratch and now I am earning every day.,6.674,110.379,189.951,9,19,19,20 tokens,81,I have started playing and soon after that I managed to get some income. You should all do the same.,9.36,16.038,90.308,2,19,19,"Gamble 5 Event A, Payoff: 42 tokens; Event B, Payoff: -6 tokens",5,poor,1,1,I am disabled and cannot work,Yes,1,"I have both, brother(s) and sister(s)",9,No,,
66a10f2d86393063bae3c12d,65fabca164fe3e3331deab93,2024-07-24T14:27:00.215000Z,2024-07-24T16:33:15.121000Z,39,Yes,22,Male,0,White,Portugal,Portugal,Portugal,Portuguese,No,Full-Time,1,94.62.0.177,1101,2,0,0,1,R_8YkRNyNIdgJhzrh,38.752,-9.2279,PT,50 tokens,Blue,1,I think we should choose what benefits both of us. That way we can ensure that we both win. I think it's the best,7.976,44.602,68.572,2,Blue,Blue,50 Tokens,82,We should contribute with lots of tokens to public fund. That way the sum is higher,7.003,107.413,179.28,4,69,89,80 tokens,51,We should split equally the tokens. It must be equal. It's fair and we both win,4.994,37.416,51.34,3,50,51,"Gamble 5 Event A, Payoff: 42 tokens; Event B, Payoff: -6 tokens",5,wealthy,0,0,Family connection in terms of degree,Yes,1,I have a brother/brothers,8,No,,
6459776ebffd7a820dd79361,613a7eb0d13f4dee9108c3d5,2023-05-08T22:27:58.467000Z,2023-05-09T00:31:25.897000,203,Yes,26,Male,0,Mixed,United States,United States,United States,English,Yes,Full-Time,1,74.101.16.146,392,2,0,0,1,R_7PhfbrDvQi7RlZy,40.7429,-73.9392,EN,50 tokens,Blue,1,"Always pick blue and hope your counterpart does the same. If you read the instructions carefully and think about it, there's no reason not to pick blue every time. I would hope others can see that too.",1.479,1.479,39.737,1,Blue,Blue,100 Tokens,50,This one was more confusing. I picked 50 because I understood what the outcome would be from the attention check on the previous page. I'm not sure how to best go about this one.,6.843,9.098,35.863,2,50,50,80 tokens,50,This is the only fair action. There's no reason for me to keep more tokens than I allocate except to be selfish and rude. I did the right thing.,4.471,6.295,32.012,2,50,50,"Gamble 1: Event A, Payoff: 10 tokens; Event B, Payoff: 10 tokens",1,well off,0,0,"sharing a bond, an understanding, familiarity",Yes,1,I have a brother/brothers,9,No,,
